{
  "id": "clean-dark",
  "name": "Clean Dark",
  "description": "Black background, white text. High contrast, professional. Good for tech, stage presentations, dark-mode lovers.",
  "colors": {
    "background": "#111111",
    "surface": "#1A1A1A",
    "primary": "#F0F0F0",
    "secondary": "#999999",
    "accent": "#F0F0F0",
    "on_accent": "#111111",
    "border": "#333333",
    "table_header_bg": "#333333",
    "table_header_text": "#F0F0F0",
    "table_row_alt": "#1A1A1A"
  },
  "typography": {
    "heading": { "family": "Arial", "weight": 700, "letterSpacing": -0.3 },
    "body": { "family": "Arial", "weight": 400, "lineHeight": 1.6 },
    "caption": { "family": "Arial", "weight": 400, "transform": "none" },
    "scale": [44, 32, 24, 18, 14, 12]
  },
  "spacing": {
    "margin": { "top": 60, "right": 72, "bottom": 52, "left": 72 },
    "gap": 24,
    "paragraph": 14
  },
  "slide": { "width": 1280, "height": 720 },
  "decorations": {
    "divider": { "style": "solid", "color": "#333333", "thickness": 1 },
    "accentBar": { "enabled": false },
    "pageNumber": { "show": true, "position": "bottom-right", "format": "number" }
  }
}
